{
  "wave_id": "PROJECT_RUNNER_PORTFOLIO_ADVANCEMENT_WAVE_V1",
  "generated_at": "2026-09-28T05:32:00-04:00",
  "corpus_binding": {
    "repository": "thebrazenbeard/project-runner",
    "ref": "portfolio/project-runner-corpus-v1-20260924",
    "commit": "634abe6a7caf944b0d7b9a64ba071f725ae97771",
    "path": "portfolio/corpus.public.json",
    "git_blob_sha": "4112da68dcf9e008f042c3284653b006d081f1e3",
    "public_repository_count": 53,
    "total_repository_count": 71,
    "private_repository_count": 18,
    "public_workstream_count": 2,
    "total_workstream_count": 15,
    "private_workstream_count": 13
  },
  "identities": {
    "ONE": "lead orchestrator/integrator; sequencing and cross-project composition",
    "REZON": "independent reasoning and assurance reviewer; evidence/claim-boundary stress test",
    "VOSS": "forensic exact-head reviewer; provenance and contradiction audit",
    "ACHILLES": "security reviewer; trust-boundary, permission and attack-path review",
    "HEPHAESTUS": "builder/architecture specialist; implementation and project structure",
    "MASAMUNE": "debugger; defect reproduction, root-cause isolation and regression verification",
    "DISCOVERY": "portfolio source/registry owner; census, overlap and capability discovery",
    "ROOTS": "provenance reviewer; origin, derivation and evidence-chain verification",
    "DRIFTGUARD": "behavioral/regression reviewer; drift and benchmark-lineage verification"
  },
  "policy": {
    "protected_effects_forbidden_without_separate_live_authority": true,
    "merge_forbidden": true,
    "deploy_forbidden": true,
    "credential_or_permission_changes_forbidden": true,
    "destructive_cleanup_forbidden": true,
    "default_effect_ceiling": "SOURCE_ONLY",
    "priority_is_authority": false,
    "execution_rule": "Every corpus subject receives a bounded frontier disposition; active work advances by source/branch/PR/review, stable/incubator work must earn continued expansion, archived/superseded work is preserved rather than revived."
  },
  "items": [
    {
      "subject_kind": "repository",
      "subject_id": "abil",
      "repository": "thebrazenbeard/abil",
      "priority": "P1",
      "family_id": "industrial-intelligence",
      "activity_state": "ACTIVE_HEAVY",
      "lead_identity": "HEPHAESTUS",
      "reviewer_identities": [
        "REZON",
        "ACHILLES"
      ],
      "action": "EXECUTE_FRONTIER",
      "execution_state": "QUEUED",
      "effect_ceiling": "SOURCE_ONLY",
      "review_gate": "EXACT_HEAD_REVIEW",
      "frontier": "Reconcile the research stack into an executable bounded industrial-intelligence path.",
      "source_status": "Large active research/assurance stack spans currentness, execution evidence, anti-replay and governance."
    },
    {
      "subject_kind": "repository",
      "subject_id": "attune",
      "repository": "thebrazenbeard/Attune",
      "priority": "P2",
      "family_id": "cognitive-subsystems",
      "activity_state": "STABLE",
      "lead_identity": "REZON",
      "reviewer_identities": [
        "VOSS"
      ],
      "action": "VERIFY_REUSE_OR_HOLD",
      "execution_state": "QUEUED",
      "effect_ceiling": "SOURCE_ONLY",
      "review_gate": "CONSUMER_EVIDENCE",
      "frontier": "Use only when a concrete runtime needs attunement.",
      "source_status": "Foundation contracts are merged; no current pull request."
    },
    {
      "subject_kind": "repository",
      "subject_id": "axle",
      "repository": "thebrazenbeard/axle",
      "priority": "P1",
      "family_id": "industrial-intelligence",
      "activity_state": "ACTIVE_HEAVY",
      "lead_identity": "HEPHAESTUS",
      "reviewer_identities": [
        "ACHILLES",
        "REZON"
      ],
      "action": "EXECUTE_FRONTIER",
      "execution_state": "QUEUED",
      "effect_ceiling": "SOURCE_ONLY",
      "review_gate": "EXACT_HEAD_REVIEW",
      "frontier": "Complete bounded wake-word and bench hardware qualification while preserving the read-only vehicle boundary.",
      "source_status": "Executable core and hardware contract are on main; production hardware remains unqualified."
    },
    {
      "subject_kind": "repository",
      "subject_id": "bt2",
      "repository": "thebrazenbeard/bt2",
      "priority": "P0",
      "family_id": "portfolio-spine",
      "activity_state": "ACTIVE_HEAVY",
      "lead_identity": "ONE",
      "reviewer_identities": [
        "REZON",
        "VOSS"
      ],
      "action": "EXECUTE_FRONTIER",
      "execution_state": "QUEUED",
      "effect_ceiling": "SOURCE_ONLY",
      "review_gate": "EXACT_HEAD_REVIEW",
      "frontier": "Close currentness/database resilience gaps while preserving exact qualification boundaries.",
      "source_status": "Database qualification, WoWSQL resilience, training preservation and portfolio consolidation remain active."
    },
    {
      "subject_kind": "repository",
      "subject_id": "bugops",
      "repository": "thebrazenbeard/bugops",
      "priority": "P2",
      "family_id": "assurance-and-repair",
      "activity_state": "STABLE",
      "lead_identity": "REZON",
      "reviewer_identities": [
        "ACHILLES",
        "MASAMUNE"
      ],
      "action": "VERIFY_REUSE_OR_HOLD",
      "execution_state": "QUEUED",
      "effect_ceiling": "SOURCE_ONLY",
      "review_gate": "CONSUMER_EVIDENCE",
      "frontier": "Remain an incident source rather than a competing orchestrator.",
      "source_status": "Recent incident repair is merged; no current pull request."
    },
    {
      "subject_kind": "repository",
      "subject_id": "build-team-2.0",
      "repository": "thebrazenbeard/build-team-2.0",
      "priority": "P4",
      "family_id": "portfolio-spine",
      "activity_state": "SUPERSEDED",
      "lead_identity": "ONE",
      "reviewer_identities": [
        "REZON",
        "VOSS"
      ],
      "action": "PRESERVE_ONLY",
      "execution_state": "HELD",
      "effect_ceiling": "NO_EFFECT",
      "review_gate": "NO_NEW_WORK",
      "frontier": "Preserve history; do not start new canonical work here.",
      "source_status": "Operationally superseded by bt2."
    },
    {
      "subject_kind": "repository",
      "subject_id": "ccb-core",
      "repository": "thebrazenbeard/ccb-core",
      "priority": "P2",
      "family_id": "coordination",
      "activity_state": "STABLE",
      "lead_identity": "ONE",
      "reviewer_identities": [
        "ACHILLES",
        "REZON"
      ],
      "action": "VERIFY_REUSE_OR_HOLD",
      "execution_state": "QUEUED",
      "effect_ceiling": "SOURCE_ONLY",
      "review_gate": "CONSUMER_EVIDENCE",
      "frontier": "Keep the public core narrow while operational transport evolves separately.",
      "source_status": "Initial sanitized extraction is complete."
    },
    {
      "subject_kind": "repository",
      "subject_id": "conations",
      "repository": "thebrazenbeard/conations",
      "priority": "P2",
      "family_id": "cognitive-subsystems",
      "activity_state": "STABLE",
      "lead_identity": "REZON",
      "reviewer_identities": [
        "VOSS"
      ],
      "action": "VERIFY_REUSE_OR_HOLD",
      "execution_state": "QUEUED",
      "effect_ceiling": "SOURCE_ONLY",
      "review_gate": "CONSUMER_EVIDENCE",
      "frontier": "Treat wants/goals as provenance-bearing state, not standing instruction.",
      "source_status": "Continuity-gap work is merged."
    },
    {
      "subject_kind": "repository",
      "subject_id": "deepmemorystorage",
      "repository": "thebrazenbeard/deepmemorystorage",
      "priority": "P2",
      "family_id": "memory-and-provenance",
      "activity_state": "STABLE",
      "lead_identity": "ROOTS",
      "reviewer_identities": [
        "VOSS",
        "REZON"
      ],
      "action": "VERIFY_REUSE_OR_HOLD",
      "execution_state": "QUEUED",
      "effect_ceiling": "SOURCE_ONLY",
      "review_gate": "CONSUMER_EVIDENCE",
      "frontier": "Donate proven memory mechanisms to current runtime instead of creating another authority.",
      "source_status": "Integration architecture is merged; repo is quiet."
    },
    {
      "subject_kind": "repository",
      "subject_id": "discovery",
      "repository": "thebrazenbeard/discovery",
      "priority": "P0",
      "family_id": "portfolio-spine",
      "activity_state": "ACTIVE",
      "lead_identity": "DISCOVERY",
      "reviewer_identities": [
        "ONE",
        "REZON"
      ],
      "action": "EXECUTE_FRONTIER",
      "execution_state": "QUEUED",
      "effect_ceiling": "SOURCE_ONLY",
      "review_gate": "EXACT_HEAD_REVIEW",
      "frontier": "Refresh census and feed descriptive inventory into Project Runner.",
      "source_status": "Discovery has 66-cut refresh candidates, but live membership advanced again to 67 repositories with SQL Connectome."
    },
    {
      "subject_kind": "repository",
      "subject_id": "driftguard",
      "repository": "thebrazenbeard/driftguard",
      "priority": "P1",
      "family_id": "assurance-and-repair",
      "activity_state": "ACTIVE",
      "lead_identity": "DRIFTGUARD",
      "reviewer_identities": [
        "REZON",
        "MASAMUNE"
      ],
      "action": "EXECUTE_FRONTIER",
      "execution_state": "QUEUED",
      "effect_ceiling": "SOURCE_ONLY",
      "review_gate": "EXACT_HEAD_REVIEW",
      "frontier": "Finish effect fencing while retaining exact-subject qualification.",
      "source_status": "Benchmark-lineage governance is on main; effect reservation/dispatch fencing remains open."
    },
    {
      "subject_kind": "repository",
      "subject_id": "empathy",
      "repository": "thebrazenbeard/empathy",
      "priority": "P2",
      "family_id": "cognitive-subsystems",
      "activity_state": "ACTIVE",
      "lead_identity": "REZON",
      "reviewer_identities": [
        "VOSS"
      ],
      "action": "EXECUTE_FRONTIER",
      "execution_state": "QUEUED",
      "effect_ceiling": "SOURCE_ONLY",
      "review_gate": "EXACT_HEAD_REVIEW",